{
  "schemaVersion": 1,
  "acceptanceMilestone": null,
  "sourceSha": null,
  "releaseTag": null,
  "status": "not-run",
  "testedAt": null,
  "expiresAt": null,
  "operator": null,
  "results": [
    { "id": "windows.download", "status": "not-run", "environment": null, "notes": null, "evidenceIds": [] },
    { "id": "windows.signature-verification", "status": "not-run", "environment": null, "notes": null, "evidenceIds": [] },
    { "id": "windows.install", "status": "not-run", "environment": null, "notes": null, "evidenceIds": [] },
    { "id": "windows.invitation-open", "status": "not-run", "environment": null, "notes": null, "evidenceIds": [] },
    { "id": "windows.service-choice", "status": "not-run", "environment": null, "notes": null, "evidenceIds": [] },
    { "id": "windows.account-creation", "status": "not-run", "environment": null, "notes": null, "evidenceIds": [] },
    { "id": "windows.provider-sso", "status": "not-run", "environment": null, "notes": null, "evidenceIds": [] },
    { "id": "windows.community-join", "status": "not-run", "environment": null, "notes": null, "evidenceIds": [] },
    { "id": "windows.restart-resume", "status": "not-run", "environment": null, "notes": null, "evidenceIds": [] },
    { "id": "windows.update", "status": "not-run", "environment": null, "notes": null, "evidenceIds": [] },
    { "id": "windows.uninstall", "status": "not-run", "environment": null, "notes": null, "evidenceIds": [] },
    { "id": "windows.residue", "status": "not-run", "environment": null, "notes": null, "evidenceIds": [] },
    { "id": "public-release.signed-installer", "status": "not-run", "environment": null, "notes": null, "evidenceIds": [] },
    { "id": "public-release.checksums", "status": "not-run", "environment": null, "notes": null, "evidenceIds": [] },
    { "id": "public-release.sbom", "status": "not-run", "environment": null, "notes": null, "evidenceIds": [] },
    { "id": "public-release.github-asset", "status": "not-run", "environment": null, "notes": null, "evidenceIds": [] },
    { "id": "public-release.canonical-latest-route", "status": "not-run", "environment": null, "notes": null, "evidenceIds": [] },
    { "id": "public-release.updater-manifest", "status": "not-run", "environment": null, "notes": null, "evidenceIds": [] },
    { "id": "public-release.updater-rollback", "status": "not-run", "environment": null, "notes": null, "evidenceIds": [] },
    { "id": "public-release.legal-approval", "status": "not-run", "environment": null, "notes": null, "evidenceIds": [] },
    { "id": "public-release.live-download", "status": "not-run", "environment": null, "notes": null, "evidenceIds": [] },
    { "id": "provider.production-registrations", "status": "not-run", "environment": null, "notes": null, "evidenceIds": [] },
    { "id": "provider.callback-routing", "status": "not-run", "environment": null, "notes": null, "evidenceIds": [] },
    { "id": "provider.cancel-retry", "status": "not-run", "environment": null, "notes": null, "evidenceIds": [] },
    { "id": "provider.session-refresh", "status": "not-run", "environment": null, "notes": null, "evidenceIds": [] },
    { "id": "provider.account-removal", "status": "not-run", "environment": null, "notes": null, "evidenceIds": [] },
    { "id": "provider.revocation", "status": "not-run", "environment": null, "notes": null, "evidenceIds": [] },
    { "id": "community-hosted.dns", "status": "not-run", "environment": null, "notes": null, "evidenceIds": [] },
    { "id": "community-hosted.tls", "status": "not-run", "environment": null, "notes": null, "evidenceIds": [] },
    { "id": "community-hosted.federation-independent-account", "status": "not-run", "environment": null, "notes": null, "evidenceIds": [] },
    { "id": "community-hosted.backup", "status": "not-run", "environment": null, "notes": null, "evidenceIds": [] },
    { "id": "community-hosted.destructive-restore-cycle-1", "status": "not-run", "environment": null, "notes": null, "evidenceIds": [] },
    { "id": "community-hosted.destructive-restore-cycle-2", "status": "not-run", "environment": null, "notes": null, "evidenceIds": [] },
    { "id": "community-hosted.monitoring", "status": "not-run", "environment": null, "notes": null, "evidenceIds": [] },
    { "id": "community-hosted.rate-limits", "status": "not-run", "environment": null, "notes": null, "evidenceIds": [] },
    { "id": "community-hosted.abuse-handling", "status": "not-run", "environment": null, "notes": null, "evidenceIds": [] },
    { "id": "community-hosted.signing-key-backup", "status": "not-run", "environment": null, "notes": null, "evidenceIds": [] },
    { "id": "community-hosted.migration-material", "status": "not-run", "environment": null, "notes": null, "evidenceIds": [] },
    { "id": "community-hosted.incident-response", "status": "not-run", "environment": null, "notes": null, "evidenceIds": [] },
    { "id": "community-hosted.failure-recovery", "status": "not-run", "environment": null, "notes": null, "evidenceIds": [] },
    { "id": "accessibility.nvda", "status": "not-run", "environment": null, "notes": null, "evidenceIds": [] },
    { "id": "accessibility.voiceover", "status": "not-run", "environment": null, "notes": null, "evidenceIds": [] },
    { "id": "accessibility.orca", "status": "not-run", "environment": null, "notes": null, "evidenceIds": [] },
    { "id": "accessibility.webview2", "status": "not-run", "environment": null, "notes": null, "evidenceIds": [] },
    { "id": "accessibility.wkwebview", "status": "not-run", "environment": null, "notes": null, "evidenceIds": [] },
    { "id": "accessibility.webkitgtk", "status": "not-run", "environment": null, "notes": null, "evidenceIds": [] },
    { "id": "accessibility.keyboard-only", "status": "not-run", "environment": null, "notes": null, "evidenceIds": [] },
    { "id": "accessibility.zoom-200", "status": "not-run", "environment": null, "notes": null, "evidenceIds": [] },
    { "id": "accessibility.large-text", "status": "not-run", "environment": null, "notes": null, "evidenceIds": [] },
    { "id": "accessibility.reduced-motion", "status": "not-run", "environment": null, "notes": null, "evidenceIds": [] },
    { "id": "accessibility.high-contrast", "status": "not-run", "environment": null, "notes": null, "evidenceIds": [] },
    { "id": "public-service.matrix-org", "status": "not-run", "environment": null, "notes": null, "evidenceIds": [] },
    { "id": "public-service.tchncs-de", "status": "not-run", "environment": null, "notes": null, "evidenceIds": [] },
    { "id": "public-service.quassel-io", "status": "not-run", "environment": null, "notes": null, "evidenceIds": [] },
    { "id": "native-invite.macos-installed-protocol", "status": "not-run", "environment": null, "notes": null, "evidenceIds": [] },
    { "id": "native-invite.macos-cold-start", "status": "not-run", "environment": null, "notes": null, "evidenceIds": [] },
    { "id": "native-invite.linux-installed-protocol", "status": "not-run", "environment": null, "notes": null, "evidenceIds": [] },
    { "id": "native-invite.linux-cold-start", "status": "not-run", "environment": null, "notes": null, "evidenceIds": [] }
  ],
  "artifacts": []
}
